{
  "updated_at": "2026-03-31T00:00:00Z",
  "communication": {
    "tone": "professional",
    "persona": "senior_dev"
  },
  "technical": {
    "detail_level": "full",
    "autonomy": "balanced",
    "quality": "production"
  },
  "working_style": {
    "pace": "fast",
    "feedback": "direct"
  }
}
